scenario,path,adj_eps,terminal_pe,implied_price,vs_price_277.64_pct,probability_weight,notes
current,"Live market 2026-06-22",11.50,24.1,277.64,0.0,,"FY26 guide midpoint $11.50 x ~24x = current price $277.64; mkt cap ~$100.3B"
bear,"Calpine deleverage stalls / re-rates toward merchant multiple; no new premium PPA; power softens toward ~$25 PTC floor; multiple -> ~17-18x",12.0,18.0,216.0,-22.2,0.30,"Multiple compression on an INTACT franchise (PTC-floored), not earnings collapse. Refreshed leverage ~2.25x makes this leg milder than the seed's 3.8x assumption"
base,"Crane delivers 2027; Calpine accretes + deleverages to ~2.0-2.25x; 1-2 new PPAs; premium ~24-25x holds",13.0,25.0,325.0,17.1,0.45,"Implied 13.0 x 25 = 325; reconciles to memo $300-340 band"
bull,"Multiple premium PPAs + uprates + 2nd restart; leverage -> 2x; multiple ~30x",13.8,30.0,414.0,49.1,0.25,"Implied 13.8 x 30 = 414; matches the prior 52wk-high froth zone; catalyst-dependent on UNSIGNED PPAs"
prob_weighted,"0.30*216 + 0.45*325 + 0.25*414",,,314.0,13.1,,"Probability-weighted fair value ~$314 vs current $277.64 = ~+13% expected upside; favorable skew (shallow floored bear)"
analyst_low,"Lowest Street target (S16, 2026-06-18)",,,296.0,6.6,,"Even the LOW Street target is above the current price"
analyst_median,"Street median (S16, 23 analysts, Buy)",,,360.0,29.7,,""
analyst_high,"Highest Street target (S16)",,,441.0,58.8,,""
